{
  "packageVersion": "0.1.0",
  "schemaVersion": "0.2",
  "flowId": "u1.trial.v2",
  "flowVersion": "0.4.0",
  "courseId": "sujiao-math-2026",
  "unitId": "u1",
  "nodeId": "trial",
  "initialStep": "diagnose",
  "labels": {"badge":"教学试点","title":"试商与调商 V2","description":"答对还要说得通；典型错误只修当前概念，不整段重学。"},
  "objectives": {"estimate":"O-U1-TRIAL-01","product":"O-U1-TRIAL-02","remainder":"O-U1-TRIAL-03","verify":"O-U1-TRIAL-04","explain":"O-U1-TRIAL-05"},
  "misconceptions": {"remainder":"M-U1-TRIAL-02","verifyApprox":"M-U1-TRIAL-03","luckyGuess":"M-U1-TRIAL-04"},
  "steps": {
    "diagnose": {"objectiveId":"O-U1-TRIAL-03","hints":["","只比较余数和除数，不急着算完整答案。","余数如果达到除数，说明至少还能组成一整组。","这里余数28，除数也是28；把它们放在一起比较。","196－28×6＝28，而28÷28＝1，所以还可以再分一组。"],"view":{"title":"先判断，再解释","prompt":"196÷28，把28看成30先试商6。28×6＝168，196－168＝28。余下的28还能再分成一整组吗？","choices":[["can","能"],["cannot","不能"]],"renderer":"ratioBar","rendererArgs":[196,168,28,"196中已分168，余28，与一组28比较"]},"transitions":[{"when":"can","to":"reasonRemainder","effects":[{"type":"markObjective","stage":"diagnostic_success"}]},{"when":"cannot","to":"repairRemainder","lane":"repair","effects":[{"type":"markMisconception","id":"M-U1-TRIAL-02","confidence":"high"}]}]},
    "reasonRemainder": {"objectiveId":"O-U1-TRIAL-05","hints":["","想一想“余数必须小于除数”是什么意思。","如果余数和除数相等，余数还没有小于除数。","28个正好就是一整组28个。","所以“能”不是猜的：因为余数28达到除数28，还能再组成一整组。"],"view":{"title":"你为什么判断“还能分”？","prompt":"选出真正能说明理由的一项。","choices":[["becauseEnough","因为余数28已经达到除数28，还能组成一整组"],["becauseNear","因为28接近30"],["becauseEven","因为196是偶数"]],"renderer":"ratioBar","rendererArgs":[196,168,28,"余数28与一组28等量"]},"transitions":[{"when":"becauseEnough","to":"contrast","lane":"fast","effects":[{"type":"markObjective","stage":"diagnostic_success"},{"type":"emit","event":"EXPLANATION_PASS","result":{"independent":true}}]},{"when":"*","to":"repairRemainder","lane":"repair","effects":[{"type":"markMisconception","id":"M-U1-TRIAL-04","confidence":"medium"}]}]},
    "repairRemainder": {"objectiveId":"O-U1-TRIAL-03","hints":["","只比较28和28。","余数至少达到除数时还能组成一组。","把余下的28看成一盒完整的28。","28÷28＝1，余下28正好还能分1组。"],"view":{"title":"只修一个概念：余数约束","prompt":"每组需要28，余下也是28。这个余数够不够再组成一整组？","choices":[["enough","够"],["not","不够"]],"renderer":"ratioBar","rendererArgs":[196,168,28,"余数28等于一整组28"]},"transitions":[{"when":"enough","to":"repairAdjust"}]},
    "repairAdjust": {"objectiveId":"O-U1-TRIAL-03","hints":["","还能多分一组时，商应该朝哪个方向变化？","多分一组意味着商增加1。","当前试商6，再多1组就是7。","6＋1＝7，所以应把商调大。"],"view":{"title":"你来决定怎么调商","prompt":"既然还能再分一组，当前试商6应该怎样调整？","choices":[["up","调大"],["down","调小"],["same","不变"]]},"transitions":[{"when":"up","to":"freshRemainder","effects":[{"type":"emit","event":"REPAIR_SUCCESS","result":{"misconception_id":"M-U1-TRIAL-02"}},{"type":"resolveMisconception","id":"M-U1-TRIAL-02"},{"type":"resolveMisconception","id":"M-U1-TRIAL-04","confidence":"medium"},{"type":"markObjective","stage":"guided_success"},{"type":"scheduleReview","reason":"misconception_repair"},{"type":"assignVariant"}]}]},
    "freshRemainder": {"objectiveId":"O-U1-TRIAL-03","hints":["","先看“余数”和“除数”的大小关系。","只要余数不小于除数，就还可以再分一组。","把图中的黄色余量和一整组宽度对比。","余数达到或超过除数，所以当前试商仍偏小。"],"variants":[{"id":"rv-172-28","a":172,"b":28,"q":5,"p":140,"r":32,"answer":"can"},{"id":"rv-252-36","a":252,"b":36,"q":6,"p":216,"r":36,"answer":"can"},{"id":"rv-329-47","a":329,"b":47,"q":6,"p":282,"r":47,"answer":"can"}],"view":{"title":"换一道新题确认，不背答案","promptTemplate":"{{variant.a}}÷{{variant.b}}先试商{{variant.q}}。{{variant.b}}×{{variant.q}}＝{{variant.p}}，余数{{variant.r}}。还能再分一组吗？","choices":[["can","能"],["cannot","不能"]],"renderer":"ratioBar","rendererArgs":["{{variant.a}}","{{variant.p}}","{{variant.b}}","{{variant.a}}中已分{{variant.p}}，余{{variant.r}}，与一组{{variant.b}}比较"]},"transitions":[{"when":"variantAnswer","to":"contrast","lane":"standard","effects":[{"type":"emit","event":"REPAIR_SUCCESS","result":{"fresh_variant":true}},{"type":"markObjective","stage":"independent_success"},{"type":"clearVariant"}]}]},
    "contrast": {"objectiveId":"O-U1-TRIAL-04","hints":["","30只是为了让试商更方便，题目里的除数没有变。","真正检验答案，要用原题中的数。","原题是196÷28，所以乘回去应使用28。","近似数负责“估”，原除数负责“验”。"],"view":{"title":"试商和验证不是同一个数","prompt":"把28看成30只是为了试商。真正验证196÷28的商时，应该用哪个除数乘回去？","choices":[["28","原除数28"],["30","近似数30"]]},"transitions":[{"when":"28","to":"formalize","effects":[{"type":"markObjective","stage":"guided_success"}]},{"when":"30","to":"repairVerify","lane":"repair","effects":[{"type":"markMisconception","id":"M-U1-TRIAL-03","confidence":"high"}]}]},
    "repairVerify": {"objectiveId":"O-U1-TRIAL-04","hints":["","哪个数来自原题，哪个数只是临时近似？","28来自原题，30只是帮助试商。","用28乘回去检验。","28×7＝196，所以验证阶段必须使用28。"],"view":{"title":"回到原题","prompt":"原题是196÷28；30只是近似。验证商时该使用？","choices":[["28","原除数28"],["30","近似数30"]]},"transitions":[{"when":"28","to":"formalize","lane":"standard","effects":[{"type":"emit","event":"REPAIR_SUCCESS","result":{"misconception_id":"M-U1-TRIAL-03"}},{"type":"resolveMisconception","id":"M-U1-TRIAL-03"},{"type":"markObjective","stage":"guided_success"}]}]},
    "formalize": {"objectiveId":"O-U1-TRIAL-05","hints":["","把“估”和“验”分开想。","试商可以借助接近的整十数，但验证要回到原除数。","再加上两条调商条件：乘积过大→调小；余数还能成组→调大。","完整规律：近似数帮助试商；原除数负责验证；乘积过大调小，余数不小于除数调大。"],"view":{"title":"现在才把规律说完整","prompt":"哪一句最准确地总结刚才的发现？","choices":[["rule","近似数帮助试商；原除数负责验证；乘积过大调小，余数不小于除数调大"],["near","只要把除数看成整十数，最后也一直用整十数"],["guess","试商主要靠猜，多试几次就行"]]},"transitions":[{"when":"rule","to":"independent","effects":[{"type":"setFlag","key":"formalized","value":true},{"type":"emit","event":"FORMALIZATION_UNLOCKED","result":{"rule":"estimate-with-near-ten;verify-with-original;adjust-by-product-and-remainder"}},{"type":"markObjective","stage":"guided_success"}]}]},
    "independent": {"objectiveId":"O-U1-TRIAL-02","hints":["","先看38×7和228谁大。","乘积超过被除数，说明分得太多。","38×7＝266＞228。","乘积过大，所以商7偏大，应调小。"],"view":{"title":"撤掉支架，独立判断","prompt":"228÷38试商7，38×7＝266。下一步应该？","choices":[["down","把商调小"],["up","把商调大"],["same","商不变"]],"renderer":"compareBars","rendererArgs":[228,266,"比较被除数228与乘积266"]},"transitions":[{"when":"down","to":"transfer","effects":[{"type":"emit","event":"INDEPENDENT_PASS","result":{"independent":true}},{"type":"markObjective","stage":"independent_success"}]}]},
    "transfer": {"objectiveId":"O-U1-TRIAL-01","hints":["","先看49×7和356，再看余数。","49×7＝343，没有超过356。","356－343＝13，且13＜49。","乘积不过大、余数又小于除数，所以试商7合适。"],"view":{"title":"迁移：换除数、换被除数","prompt":"356÷49，把49看成50后试商7。49×7＝343，余数13。这个试商怎样？","choices":[["fit","合适"],["up","偏小，要调大"],["down","偏大，要调小"]],"renderer":"ratioBar","rendererArgs":[356,343,49,"356中已分343，余13，小于一组49"]},"transitions":[{"when":"fit","to":"complete","effects":[{"type":"emit","event":"TRANSFER_PASS","result":{"independent":true}},{"type":"markObjective","stage":"transfer_success"},{"type":"markObjective","objectiveId":"O-U1-TRIAL-04","stage":"transfer_success"}]}]},
    "complete": {"objectiveId":"O-U1-TRIAL-04","hints":["","","","",""],"reviewOnH4":false,"view":{"title":"你已经完成“试商—验证—调商”闭环","prompt":"试商可以借助近似数降低估算难度，但判断商是否合适必须回到原除数：乘积超过被除数就调小；余数不小于除数就调大。","choices":[]},"transitions":[]}
  }
}
